text	label		
why is a sitting senator focused on a nyt piece that was published a year ago when he could be focused on say the  coronavirus  and the 140000 americans that have died?	0		
both of these crises are symptoms of lack of respect for each other and for the natural world.  says the coronavirus and climate crisis have a similar root cause but should not be compared to each other  	0		
waiting for covid vaccine   	1		
now the research from who is showing that the risk of asymptomatic people transmitting coronavirus is extremely rare. if that is true that means we do not need social distancing masking and it means that we can reopen america and get back to life as normal reopenamerica	1		
i hope they choose a new actor for the role of dr fauci on next season of  coronavirus	1		
new pres trump says he is restarting coronavirus briefings. i think its a great way to get information out to the public, he says, adding we had a lot of people watching in the history of cable television. theres never been anything like it  	2		
us coronavirus 3960583 cases and 143792 deaths reported in the united states to date.  62033 new cases and 504 new deaths have been reported so far today	1		
be safe we can beat coronavirus!	2		
trump admits he is tested for covid daily as are his family and senior staff. he knows the importance of testing for himself he does not care about the rest of you	0		
gov cuomo and new yorkers earn high praise from dr fauci. keep it up ny!  fauci holds up new york as model for fighting  coronavirus. they did it correctly    	2		
coronavirus news a young woman whose lungs were ravaged by covid19 is alive thanks to a double lung transplant say her surgeons. in chicago, this is the first known lung transplant in the us for covid19. offering new hope for patients heres the story	2		
got my dream car! now covid needs to be over so it can be road tripping time  	2		
covid  or no covid, please just stay away from me	1		
keep a safe physical distance and ive just witnessed a group of ladies kissing each other, shaking hands, having close conversations unmasked in a cafe in bangsar its as though covid 19 never existed  	0		
addendum its pretty incredible that were 6 months since our 1st covid19 case. is still incapable of understanding that the most important thing we must get right w kids in schools is minimizing how they spread the virus to adults 	0		
sending you love if you just started quarantining and are feeling antsy	2		
think of the insanity donald trump says its unsafe for roger stone or paul manaford to sit in a jail cell because of coronavirus  but its perfectly safe to leave your child in a room for six or eight hours with 20 other kids teachers and school staff   keepyourchildhome	0		
todays mbmc  covid  report 2072020  todays positive case. 126 recoverd today.  92 death today.  6 total death till now  226  	1		
i hope fake doctor rand paul gets covid  twice. he needs to shut his stupid kentucky mouth	0		
not only have there been no deaths from coronavirus in scotland in last 24 hours, there are now only 7 people with covid  still in intensive care in whole country. none outside lothian. praise where praise is due to nhs carers 	2		
why is dr fauci throwing out the first pitch of a baseball game if covid19 is raging out of control in america?	0		
negative for coronavirus but still positive for being a bitch   	1		
couple under house arrest after testing positive for covid 19  	1		
first human trial of oxford coronavirus vaccine shows promise	2		
uk secures supply for potential german coronavirus vaccine  	2		
 federal government is taking all possible steps to halt the spread of the novel coronavirus 	2		
i remember when cnn had her on panel of medical experts discussing the  coronavirus. why is she such an expert on climate change and the coronavirus? because theyre both scams scamdemic	0		
a coronavirus  vaccine the university of oxford is developing with astrazeneca plc showed promising results in early human testing, a sign of progress in the highstakes pursuit of a shot to defeat the pathogen  	2		
appreciates his fans for their work in extending relief to needy during coronavirus outbreak. urges them to take care of their families, wear mask, and follow social distancing	2		
face masks could reduce coronavirus number and prevent 2nd wave, scientists say. this is very hopeful news 	2		
i actually think 2020 offers a unique opportunity for change. the australian bushfires should change the conversation on the environment, coronavirus should change the conversation on economic inequality, and george floyd should change the conversation on racial inequality	2		
dr samadi thank you very much for your informative and very accurate analysis of the covid  19 medical issues. as a colleague physician and fellow scientist i can confirm that your evidenced based recommendations are spot on. keep up the great work	2		
what didnt happen is always hard to appreciate. solomon hsiang captured the power of stay at home orders vividly. no human effort has ever saved so many lives in such a short period of time 	2		
another 12000 florida case count day. now topping 5000 total deaths and 13 of them in miamidade county. Yet, desantis still called it a blip few days ago. we need leadership and action over euphemisms 	0		
this old school throwback jeopardy week is the best outcome of coronavirus so far  	2		
these are shocking visuals from rajamahendravaram. hundreds of residents are seen waiting to be tested for covid 19. theres no social distancing, theres no help from the govt. these testing centres are becoming breeding grounds for the coronavirus due to ap govts incompetence  	0		
oh wow this also seems very hopeful!	2		
these coronavirus  victory laps are so embarrassing for fox news. theyre all gonna have to go tuesday trout fishing  	0		
results from trials involving three different coronavirus  vaccines all showed positive results with evidence the vaccines can produce immune responses that would be expected to protect people against infection. more research will still be needed  	2		
are you a nurse doctor or other health professional? here are some ways to cope with the stress during covid 19  	1		
why is it every democrat solution to covid involves some version of wrecking the economy? we have been through countless pandemics before and never applied such draconian measures. why now? and if  covid  is such a naturalborn killer why does the cdc have to fake their stats?	0		
indias covid crisis its difficult to get tested , its difficult to get ambulance, its difficult to get hospital beds, its difficult to pay hospital bill.  what is the situation in ur city town village? please reply, let others know covid reality 	0		
friends im successfully recovered from covid  	2		
iloilo planning to have a covid  lab test on its international airport to trace the virus immediately for inbound and outbound passengers 	1		
a former cdc director found the white house document that we published last week to be full of good advice advice that would be helpful for all americans to see 	2		
i raised three children. when they were sick i never took them to a politician. listen to docs science and data 	1		
 wake up, if government conduct the examinations during this pandemic crisis they are responsible for the students no matters how many students has been effected by  covid 19 	0		
fauci is a lying cherrypicking excuse artist. he knows the truth about ny, cuomo forced covid patients into nursing homes killing thousands. ny is safer now inspite of cuomo because it has developed heard immunity which is what i have been arguing for all along 	0		
switzerland is the safest place on earth coronavirus  covid19	2		
the son of a palestinian woman who was infected with  covid 19 climbed up to her hospital room to sit and see his mother every night until she passed away  	1		
bad news on the school opening front. a large study from south korea suggests that children over 10 are very effective spreaders of covid. so while preschool and very young kids may be less effective vectors, most school age kids 9 are good vectors  	0		
trump officials want no money for covid testing and tracing in the next coronavirus bill	1		
the irony is that our govt was given 5 months to prep for covid 19 outburst and are still asking time. whereas, we were accused of being unprepared for asking the postponement of kcetwhile. we just want to ensure the safety of ppl who are in danger because of your unpreparedness	0		
thousands of airport workers won the votes in the new york legislature and passed the healthy terminals act. once signed into law this bill will give frontline airport workers access to affordable health care. congratulations to workers on this victory!	2		
my brother sp  has made a freaking video that explains the dire situation of students. say no to exams in covid situation exams in covid a suicide    	1		
new zealand has successfully wiped out coronavirus after the final person known to have been infected has recovered	2		
daily number of covid cases took a jump of 10k within a period of 4 days only. dont understand how ugc is still going to conduct sem exams at this moment of emergency. terrible decision	0		
i tested negative for covid after 12 days. thank u everyone for your support! i watched the doctors, nurses, staff, the microbiology team of the silchar medical college closely. they are very efficient. i thank them for taking good care of me  	2		
how they bought a house during the pandemic. you might be surprised by the upsides of homebuying amid the coronavirus  pandemic  	2		
texas is a covid 19 epicenter, people are suffering, icus are at capacity, children are contracting it, and the junior senator from texas the one who doesnt wear a mask on planes busies himself picking fights over black beans and basketball because priorities  	0		
the researchers found that during the lockdown the rate of babies born before 28 weeks had dropped by a startling 90 percent	2		
what is a conspiracy theory but a lie it comprehensively violates the ninth commandment. a conspiracist bears false witness, he accuses his fellow citiznes of grievous sins, he destroys their good name and he can incite violence. how should we react 	0		
i mustache you a question are you sick and tired of this covid mess  	1		
maybe its bc i saw what my parents went through when my brother died but the school reopening is really making me upset in a way nothing has since covid started. i feel like so many families are being tricked by trump and devos into the kind of loss a person cant get over	0		
if i ever die from covid please know that my dying wish is that my corpse be catapulted at high speed directly into mitch mcconnells bedroom window at 3 am	1		
i wish speedy recovery from covid 19. nigeria is eternally grateful for his diligence in attracting international support to defeat the pandemic and boost the economy. he has been a tireless worker and strong pillar of our administration	2		
let me show my biggest flex of 2020. even though its a shitty year thanks to covid but this precious girl of mine came into my life this year teehee   	1		
breaking health officials on monday reported 102 cases of  covid 19 in bc over the past 72 hours  	1		
thank you health care professionals for being so brave in this trying time. you all really are heros!	2		
my mom is fighting  covid 19 in the hospital, my aunt too. my grandpa uncle and childhood neighbor passed on yesterday. please keep us in your prayers	1		
florida man who died in motorcycle crash listed among  covid 19 fatalities  	1		
we are going to come out of this bigger, stronger and more resilient than ever before. we will take down the deep state and we will overcome the politicization of  covid.  this is the american way	2		
the good news is the coronavirus can be almost entirely contained with a national strategy. Vietnam, czech republic, new zealand, italy, germany, s korea, hong kong, have all showed coordinated strategy works	2		
before she died from coronavirus  this young palestinian man used to climb on the hospitals external window to check up on his mother  	1		
the  coronavirus  vaccine will come from the goop lab	1		
has anyone else noticed that the europe is not experiencing a second wave of  covid infections? apparently covid is magical here. either that or we have an election in november	0		
dr birxs rise inside the trump admin has tainted her reputation among colleagues who view her as having sold out to a chaotic poorly managed response that has put trumps political ambition over the health of americans.  her reputation is finished   	0		
study shows that eating kimchi can help you survive covid 19 so its time to stock up   	1		
gettin a covid test today hope it goes well ehe  	2		
hello  im  16 years old i have two other siblings  an eleven year old and a one year old. our father tested positive for covid 19 and hes already a dialysis patient, he has chronic kidney disease stage 5 unfortunately hes the breadwinner in our family and cant get by without him. pray for my family	0		
hear gov parson discuss the inevitability of kids getting covid  at school for yourself  	1		
covid has been rough  	0		
the coronavirus wont last forever we will conquer it soon! have faith	2		
a nine year old kenyan boy who made a wooden handwashing machine to help curb the spread of  coronavirus  says he is very happy after receiving a presidential award 	2		
the participants gave a practical demonstration of the precautionary measures to avoid  coronavirus  by observing social distance in their seating arrangement  	1		
the race for a vaccine against the coronavirus intensified on monday as 3 competing laboratories released promising results from early trials in humans  	2		
india is having daily 40k covid 19 cases and presently 3rd worst hit country in world. without thinking about the consequences of  covid 19 they took such an arbitrary decision and are putting their people at even more risk	0		
memory researchers say these months will become a blur for those of us isolating at home 	1		
i dont comment on royal family too often but here goes prince charles jumped the queue, prince andrew is a wrong un and coward who wont face justice, prince william thought coronavirus  was exaggerated and yet prince harry is seen as liability	0		
sinovac biotech says its coronavirus shot is safe and capable of eliciting an immune response from human trials    	2		
nearly 1400 californians with ancestry in the pacific islands have been infected with the coronavirus  and its killing them in disproportionate numbers  	0		
at the moment you are more likely to be stabbed to death than die of covid in london. where are the calls for mandatory stabvests?	1		
nicki pregnant, kanye acting up again, covid still here, and rihanna still aint drop no album  	1		
new zealand an astonishingly beautiful country free from coronavirus 	2		
scientific report shows that the mask mandate is successfully slowing the spread of  covid 19 in north texas  	2		
there is the issue of the ever increasing debt in pakistan which eats up some 30 percent of the budget every year in pakistan. this year the struggle increase due to covid 19 situation which has further repressed the economy  	0		
look after yourself both body and mind. look out for each other. be caring. be kind 	2		
for the first time since coronavirus outbreak number of recovered patients exceeded the number of active cases. we are on the right track	2		
i got a call asking for me and they told me that i had tested positive. i was like positive for what then the lady said for covid  and i said thats impossible i never got tested maam	1		
in the rush to return to normal, use this time to consider which parts of normal are worth rushing back to 	2		
our amazing police have responded to unprecedented challenges during coronavirus . to recognize their immense efforts we will be increasing their pay this year to everyone in the policing family. thank you  	2		
there are politicians who dont care about the consequences of coronavirus on the people, they only think about how to win elections  	0		
eightyfive infants who are under the age of 1 have tested positive for the  coronavirus  in nueces county, according to a report. the county which includes corpus christi has become emblematic of the recent surge of  coronavirus  cases in the state  	0		
covid 19 has polished pakistan to reach to its full potential. pakistan has started making ventilators and this is a huge achievement considering that pakistan has never made ventilators before       	2		
how does the cdc accidentally combine viral and antibody tests in major states to wildly overinflate new covid cases? they know those two are not the same thats not a mistake thats willful fraud with the intent to harm the economy by fear or lockdown	0		
new covid 19 data at 20200721 013001 am edt 	1		
unfortunately some 50 of those who recover from covid 19 seem to have a residual and permanent cardiac disability  	0		
everyone knows that dominic cummings broke the lockdown laws he helped create. what does it say about our government that he was kept in post while this nurse was dropped from briefings for telling the truth?  	0		
massively encouraging news 	2		
trump shrugs off covid death toll in fox news interview it is what it is  	1		
good news further coronavirus human vaccine trials begin next week. an encouraging step forward in our national effort against coronavirus 	2		
 teachers are to receive a 31 percent pay rise following their vital contribution during the coronavirus outbreak, the chancellor will say today  	1		
cubans celebrate no local transmission of covid 19 for first time in four months  	0		
not only is this kenyan landlord not asking for rent from his tenants who have lost out because of the virus, hes also giving them food parcels 	2		
thank you for helping get the message out about how to avoid rising covid19 numbers 	2		
doctors and nurses who helped new york with the  coronavirus surge are warning their home states. please wear your mask 	1		
linkedin has announced that it will cut around 960 jobs due to the coronavirus pandemics impact on hiring  	0		
why hasnt the homeless population been decimated by covid since they are unsanitary, dont social distance, dont wear masks?	1		
big news the oxford covid 19 vaccine is safe and produces an immune response according to preliminary results just published. its probably the leading candidate in the world	2		
seriously q what he have done other than spend our money, lose allies, send children to concentration camps, free criminals, infected 3 million plus americans with covid , unemployed more severe that in the great recession, let russians kill our soldiers soldiers for saudis  	0		
really positive suggestions here in the neus 10point national education recovery plan	2		
when a safe effective covid 19 vaccine is ready to be distributed it must be free and accessible to all	1		
lincoln project will target desantis and other maga governors in texas and georgia and arizona. they were so afraid of offending the president that they were literally willing to sacrifice their citizens as opposed to doing the right thing with the covid 19	0		
 attention my people of el monte a subway employee located on 10533 garvey ave has tested positive for covid  19. avoid that establishment	1		
disgusting garbage from the media headlines say a 13yearold died after experiencing covid symptoms. you have to read paragraphs into the reports to find out that he tested negative. exploiting a childs death and intentionally misleading the public about it. evil bastards  	0		
despite the ongoing coronavirus  pandemic fans have expressed an overwhelming desire for the return of live sports in the latest round of an espn study  	1		
its not greatness that tackles outbreaks, its ingenuity. this story outlines how rwanda, a middle income country in east africa, has crushed the coronavirus with only a tiny fraction of the means and resources available in places like the us  	2		
older children spread the coronavirus  just as much as adults large study finds     	1		
new covid 19 data at 20200721 	1		
covid test at 5pm  	1		
beyond pcr a guide to the dozens of different coronavirus diagnostics in development  	1		
trump flails in interview with fox news citing false and nonexistent data on covid   	0		
cant stop thinking about how stark the contrast is between the urgency of the governments response to statues being vandalized vs 140000 covid 19 deaths	0		
major relief brought in gst filings for small taxpayers in wake of coronavirus  pandemic	2		
we can make this into anything 	2		
breaking news tricky trump announces his possible dictatorship after losing election. then he will make tricky trump virus covid 19 disappear because he is always right. remember in november  	0		
dont let coronavirus distract you that derrick henry has more passing tds in the playoffs than carson wentz  	1		
god can covid end already i cant stand this toxic household anymore 	0		
one of my long time favourites copenhagens pedestrian friendly transformation didnt happen overnight but are we now seeing this kind of urban transformation in weeks or months instead of years or decades because of coronavirus?	2		
confirmed lois tests positive for coronavirus   	1		
 this is the difference between pakistan and india covid 19 measures. due to the decisive policies of imran khan there is a downward trend of covid  19 and decreasing every day  	2		
accurate as fuck rickandmorty coronavirus   	2		
these comments by dr fauci are a slap in the face to the thousands of new yorkers who suffered immensely due to the inept and fatal policy errors from governor andrew cuomo 	0		
beyoncé was set to tour europe north and south america, africa, oceania, and asia this summer. according to a number of sources it was cancelled due to covid 19  	1		
when this is over may we find that we have become more like the people we wanted to be, better for each other because of the worst	2		
amazing! new zealand has eliminated the coronavirus domestically so can lift all containment measures except for border controls thats how its done, that really is how its done    	2		
 he said that the command and control centre for coronavirus had prioritized providing safety material to the frontline medical staff especially in emergency and intensive care units icu  	1		
as of july 15 there had been 120000 covid deaths. 31 of those deaths were kids aged 0  14 thats 03 percent of the total the flu killed, three times as many kids in that age range in the same time frame  	1		
beyoncé was set to present the blackisking world tour a worldwide tour which went to europe, africa, asia, oceania, north and south america. the tour was cancelled due to covid 19  	1		
giving exams during covid going on a suicide mission. exams in covid a suicide 	0		
uk government has signed deals for 90m doses of coronavirus vaccine from foreign companies. 30m will come from biontechpfizer, a germanus partnership, and 60m from valneva, a french firm that will be manufactured in scotland	1		
a large new study from south korea finds that children younger than 10 transmit to others much less often than adults do, but the risk is not zero and those between the ages of 10 and 19 can spread the virus at least as well as adults do 	1		
how does the minister explain reports that contracts at the value of more than 830 million had been awarded to at least 12 different companies for ppe which has never materialised 	0		
shame on you ron desantis. one of the protesters shouted youre lying to the public 	0		
wear a mask 	1		
my favourite part of canadas covid response is our government officially recommends using glory holes for sex    	2		
hydroxychloroquine rated most effective coronavirus treatment, poll of doctors finds	2		
amazing to see so many nfl players tweet out publically to the nfl leadership their health worries and covid safety concerns as season nears. a few years ago this would have been impossible. special note to nfl players, dont forget to thank colin kaepernick 	2		
good morning to the covid vaccine only	1		
85 infants in one texas county test positive for coronavirus   	1		
a dealer at mohegan sun just tested positive for covid on wednesday july 15th. good luck connecticut	1		
anti mask neighbors just tested positive for covid   	1		
permanent lung damage inflammatory syndromes and damage to the heart are all things weve seen in people post covid. these are effects that may frankly be more of a risk to young people and children who are more likely to survive	0		
this is insane like saying that the best generals in world war i were the ones who lost all their soldiers in the first wave then had the lowest casualties the next month. impossible to think fauci has good judgment after this   	0		
president donald trump is clinging to the false notion that the coronavirus will just disappear. thats the finding of an apfactcheck  	0		
donald trump getting ready for his daily coronavirus  briefings  	1		
everything will be okay. a man who has tested positive for covid 19 shared on facebook the good deeds of his neighbor contributed photos  	2		
president trump asked to see the covid death chart here you go 	1		
good news for our friends, neighbours, and closest economic partners in the eu, the 182 trillion budget which includes a 750 billion  coronavirus  recovery package is a huge display of solidarity at this time of historic crisis   	2		
