text	label		
after trumps continued inaction on issues such as the russian bounty, black lives matter, and covid 19, david is voting blue this november for the first time ever. this single thing should cause all americans to lose any slice of hope they may still have	0		
no coded messages or secret sex dens in the basement of a dc pizza parlor just good old fashioned sexual harassment, sex trafficking, and retatiation at foxnews. no wonder they are too busy to report about the  coronavirus     	0		
after my friends bought the masks they found the mask helped them a lot. dwi rahayu began making these transparent face masks to help deaf and mute people communicate during the coronavirus pandemic in indonesia 	2		
todays coronavirus figures there are 7 new confirmed cases of covid 19 in scotland. no deaths have been recorded in the past 24 hours  	1		
wearing a mask for coronavirus can be a good thing especially if you have bad wrinkles, bad breath, bad teeth, or no teeth at all!!!!	2		
it is extremely unfair to conduct exams during the covid 19 pandemic. ugc must hear the voice of the students and academics exams should be cancelled and students promoted on the basis of past performance 	0		
three million people in the uk have missed vital cancer screenings, tests, or treatment since the start of lockdown as experts warn that deaths caused by delays in care will exceed coronavirus casualties  	0		
some good news in new york!!! new york tough	2		
new zealands prime minister jacinda ardern says shes confident the country has halted the spread of the  coronavirs  after the last known infected person in the country recovered. it has been 17 days since the last new case was reported there	2		
good thing for trump the coronavirus is under control	2		
robredo releases list of suggestions for govt as part of covid 19 response  	1		
we follow the science except when the science points out that were lying charlatans   	0		
a florida mother says two of her adult children died of covid 19 within 11 days of each other  	0		
painting this frame from fallen angels is the first creative thing ive started and finished during covid   	1		
are you guys for real do you seriously find it amusingby keeping kcet exams during such a pandemic??  i dont understand the necessity right now, how is that going to be safe?? It cant be	0		
prime minister imran khan on friday sounded optimistic that war against coronavirus will be won with the united resolve of the nation	2		
i wish you all a nice week let us both be careful of coronavirus	2		
warning common sense on coronavirus   	1		
trump doesnt get america in 2020. hes running the same campaign as in 2016 focused on bigotry and white supremacy but in 2020 polls show the top issue by far is covid 19. trump has failed on that issue. its time for trump to go	0		
 did you know that respiratory and contact transmission are the two major modes of transmitting covid 19 coronavirus   	1		
the uae has made a global effort in coronavirus treatment and the result will be promising, god willing. together against covid19     	2		
as the us heads into peak hurricane season a reduction in commercial airline flights due to covid 19 has significantly impacted our ability to accurately forecast the weather  	1		
no one talks about unplugging two days out of the city, i forgot all about covid, soy consumption, and fear mongers	1		
guess who is working crazy night shifts because her coworkers all have covid??  its me hit me up and make me feel better sugardaddywanted  sugarmummyneeded  plussize essentialworker 	0		
covid hospitalizations continue to rise nationally will soon eclipse prior record reached in april. however, admissions to icus have declined as percent of total hospital admissions reflecting earlier diagnosis at time of admission, better treatments, less vulnerable admissions  	1		
great news coronavirus crisis is over we can open up society, open the schools, and get back to work   	2		
this years defense budget was 90x bigger than the budget for the cdc. yet as we near 38 million covid 19 cases and 141000 deaths from the virus, trump wants to add more money for defense spending while cutting money for testing and contact tracing. we cant let him	0		
tonight i shall sit in my favourite tree and stick my tongue out to  covid  19 and hope for a vaccine covid19	1		
autopsies show 80 of covid victims had blood clots in every single major organ. this will be north americas largest preexisting condition with tens of millions potentially affected	0		
more than one in three covid cases admitted to mexican hospitals die. a big factor people are so scared of hospitals they wait until they are seriously ill before being admitted  	1		
 policies of the prime minister imran khan r in the right direction resulting in revival of economy and reduction in covid 19 cases as well  	2		
joe biden has a plan to defeat covid 19. it starts w dr fauci. will ask him to extend his service to 6 presidents by serving one more. dr fauci will have full access to the oval office  an uncensored platform to speak to the u.s. 	1		
another hell in the making post covid   	0		
last sunday germany pop 802m had 159 new cases of covid 19. florida pop 215m had 15300	1		
breaking the ballon dor will not be awarded in 2020 due to the disruption caused by the  coronavirus     	1		
how depraved do you have to be to attack the nations leading doctors like dr fauci and to keep covid data from the cdc?? donald the dope is a drug addled trainwreck 	0		
shehnaaz gills rendition of moutain dew anthem pays tribute to covid 19 heroes. see here  	2		
pls be done covid i wanna get pierced again  	1		
were battling two pandemics right now covid 19 and stupidity	0		
good chance deaths will increase further but it does seem likely that the death rate from covid is decreasing which is good news even if the number of deaths is increasing because we have so many freakin cases  	1		
he gave us joy and happiness many times when we are in sadness and now he need us he need our prayers. we will pray for you. you will be healed in jesus name. amen.    	2		
viruses dont care if you believe in them 	1		
exactly 10 days ago i went to do the covid test in london. earlier today i went for another test in abuja  	1		
1756 new hospitalizations due to coronavirus have been added to the cumulative count in the last 7 days, a 1174 increase since last week. this means the state of georgia is averaging over 250 new hospitalizations per day this week  	1		
sen romney unloads over coronavirus testing failures. its very frustrating to me that people go to get a test and have to wait 45 days to get the results. that really removes, in some respects, the whole value of testing	0		
its people like her that increase our nations risk to 2nd wave. shame on you ms and shame on yr friends family cafe who allowed her in, didnt report when shes supposed to be under quarantine. stricter measures needed  covid 19 is still out there    	0		
getting vaccines for covid tested is essential. people across the uk can register their interest to be approached to join vaccine studies. please consider volunteering the generosity of the public in taking part is essential to identify effective vaccines  	1		
our kids shouldnt be collateral damage for reelection campaign. even if kids arent hospitalized from covid 19 they will spread it to teachers, parents, grandparents and others who are at greater risk. this isnt the leadership missouri families deserve  	0		
mr president your ignorance isnt a virtue or a sign of your strength its undercutting our response to this unprecedented crisis at every turn and its costing americans their jobs and their lives 	0		
so apparently he had covid back in february and he got mad at that girl for wearing a mask  	1		
from chile to south africa to new zealand, southern hemisphere nations report far lower numbers of flu cases which they attribute to coronavirus precautions. the decline could be good news for the u.s. and europe	2		
our enemies will speak a lot but the reality remains that tanzania is safe and that is why none of us here is putting on a mask. does it mean we are not afraid of dying? no it is because coronavirus has been eliminated magufuli said  	1		
a team of mathematicians at mit has added some order to the chaos that is the rapidly growing number of online scientific talks and meetings available during the pandemic by creating a website that compiles links to free talks around the world	2		
breaking news as the white house usurps covid 19 data collection from the cdc evidence suggests gopled entities are hiding the real numbers which are harrowing  	0		
los angeles mayor eric garcetti on sunday said la opened too quickly and again warned that the city was close to imposing some type of new stayathome order as coronavirus cases continued to spike  	0		
kindly cancel the compartmental examinations where the covid cases are rising drastically. how can the board even think of conducting the exams? who will be responsible if a child gets into the trap of covid??	0		
how can govt be brutal to the students 	0		
new as outbreak goes further out of control trump asks mcconnell to zero out funds for testing contact tracing	0		
i have an idea lets start reporting the number of kids that go missing daily the same way we report covid numbers. maybe that would get peoples attention	0		
good job fauci. what a disaster. now off to throwing out the first pitch	1		
seems like a good time to remind folks of this 	1		
coronavirus  will end soon in jesus name. rt if you believe	2		
covid 19 is real but deliberately inflating the numbers is a scam	0		
good morning so theres a coronavirus outbreak at a contact tracing call centre if youre wondering how the uks worldbeating coronavirus response is going. rip to us all	0		
not only have there been no deaths from coronavirus in scotland in last 24 hours there are now only 7 people with covid still in intensive care in whole country. none outside lothian. praise where praise is due	2		
some good news in the midst of daily bad news a covid 19 vaccine being developed at oxford university could be available in a little over 14 weeks  and vaccines from moderna pfizer arent far behind. better days are ahead  lets stay positive    	2		
president, vice president, secretary mnuchin talked additional coronavirus relief and progress toward a vaccine this morning in the oval office	1		
coronavirus oxford scientists working on covid19 vaccine near breakthrough on antibody treatment  	2		
thats not real brian it was debunked a long time ago	1		
balochistan is the future of pakistan army will help its people to battle covid 19  	2		
americas coronavirus failure and its economic failure together in one chart  	0		
coronavirus staying safe and informed on twitter. helping people find reliable information 	2		
it has been over three months since senate republicans have considered major covid relief legislation while americans face this public health and economic crisis  	1		
this is embarrassing america, embarrassing.	0		
covid medical kit required at home. share to your friends and family    	1		
i really appreciate and admire his leadership during the fight against coronavirus. he is an amazing leader. great leader 	2		
new jake paul song isnt good and he most likely spreaded coronavirus to make this music video so thats a dislike from me bro	0		
the us needs to lower the transmission rate of covid 19 in order to get kids and teachers back in classrooms, the surgeon general says  	1		
couple under house arrest after testing positive for covid 19 in kentucky   	1		
coronavirus facts, tips, medical facts   	1		
it is extremely unfair to conduct exams during the covid 19 pandemic ugc must hear the voice of the students and academics exams should be cancelled and students promoted on the basis of past performance         	0		
again its time to ask whether trump wants the covid 19 numbers to get better or whether he has the same sort of internal polling nyt has published which says that trump only wins if the virus is so bad in november that turnout is significantly reduced  	0		
lets acknowledge that dan andrews is doing a great job locking down covid. hes not just fighting a highly infectious deadly disease hes also fighting his political opponents trying to undermine his efforts and the media narrative damming him whatever he does	2		
the us is the worst coronavirus hot zone in the entire world and yet cronies want to send our kids back to school endangering the lives of them their families and teachers. reckless and dangerous   keepyourchildhome   	0		
water is a human right. detroiters must have access to water before, during, and after a pandemic 	1		
how to deploy rpa responsibly in the covid 19 era  	1		
covid  is the catchall for the lefts 2020 fears. biden cant campaign or debate cause covid. in person voting nope covid. supreme court opening no confirmation hearings this year covid. trump rally forget about it covid. booming economy oops covid 	0		
news as andrew cuomo and new york democratic legislators passed legislation shielding nursing home ceos from covid  lawsuits. the health care industry lobby group that drafted the bill delivered 260000 to ny democrats political machine  	1		
coric is back for his first match since his covid diagnosis. hes is playing in belgrade at the eastern european championship  	1		
10000 people in melbourne refused to take the scam test despite heavy handed state tactics. obviously they are not convinced by the scamdemic. 100 covid deaths so called out of 25 mill is 0000004 of australias population   	0		
coronavirus vaccine developed by oxford university appears safe and trains the immune system, key early trials show  	2		
had a great time outdoor dining with michaela at the local 217 taproom kitchen in albany. thanks to owner susie for the great food, being a model of perfect covid  safety compliance  	2		
just here trying to remain soft, trying to remain strong, trying to remain grounded, trying to remain flexible, trying to remain light, trying to remain whole, figuratively, literally, all of these things. this is a great time to reflect and for self growth	2		
get well soon lala we wish you a speedy recovery	2		
my great uncle stanley passed away last night at the grand old age of 98. heres the thing, he was rushed into hospital with pneumonia and they put on the death certificate that he died with covid 19. now i know its all bollocks. a scam	0		
ny times sued for 10 million for making up covid 19 story  	1		
due to timely and welldevised strategy of the government the number of  coronavirus  cases have come down  	2		
much needed me time  during this time of self isolation. i guess quarantine has its perks	2		
positive results have now been reported from earlystage trials of four vaccines 	2		
nhl statement on covid 19 testing results  	1		
coronavirus protein treatment trial a breakthrough  	2		
former vice president biden leads president trump by a significant 12point margin nationally according to a new cnn poll of polls 	1		
good morning twitter friends! i became infected with coronavirus in july. i have officially recovered and am back on twitter thank you for your support and prayers 	2		
great leaders are not born but crafted by a societys needs. by the dint of their will toil  moral rectitude the nation expects exemplary leadership during this catastrophe 	1		
it is with great joy i want say that many people are getting cured from coronavirus. but hey dont you want more people to live with relief? help now they need you. help us spread the cure donation for plasma 	2		
it is not good news. by and large older children 1019 appear to spread disease at rates comparable to adults though younger children may be less likely to transmit the provides context 	0		
cdc says the coronavirus pandemic could be under control in four to eight weeks if everyone wore a mask starting now. lets do this people!	2		
firms with troubled pasts got millions of dollars in ppp smallbusiness aid. the paycheck protection program benefited an alleged ponzi scheme and companies accused of defrauding student borrowers and selling fake  coronavirus treatments  	0		
he got the covid 19  	1		
today is the day of my fathers funeral and its all be done virtually which makes it harder for me. he died of covid 19. i havent slept all night please say a prayer for me and my family i have to be strong for mom just not sure i can	0		
this is what the election is about trump downplayed, mismanaged and lied about  covid 19. its now completely out of hand. hundreds are dying each day and while other countrys kids are going back to school this fall ours wont  	0		
i got covid symptoms in march no community testing back then but they were typical of so called mild version. 4m on i still cant do mild exercise and get weird leg chest tightness on and off its like nothing ive had before not trying to scare u just pls dont laugh it off	0		
if you think the very same media who lied consistently for years about russian collusion wont paint a false narrative about covid to defeat trump in 2020 then youre beyond help	0		
psycho terrorist attack, she dealt with it. volcanic eruption, she dealt with it. Coronavirus, you guessed it she dealt with it. new zealand is officially corona free and that too with a strong af economy. Btw, she did all this while raising a newborn too	2		
government has introduced the biggest stimulus package in the history of the country to help the nation in this difficult time amid coronavirus  pandemic  	1		
you are soulless and cruel. my friend is grieving losing both of her in laws from coronavirus in weeks of each other as a direct result of gov cuomos directives and you assume she doesnt know health policy because she knows the science of meteorology	0		
if covid doesnt kill us woke will. everything is so serious now were afraid to laugh afraid to make the joke in case we end up in jail or as social pariah writes  	0		
its good to see that government has postponed all the ssc examinations which are going to held in the month august   	2		
3 covid deaths recorded today in all of italy. its the lowest number of recorded deaths since the outbreak in february. italys full lockdown of 2 months, ongoing high adherence to mask wearing has proven effective   	2		
its time to block those airways to reduce oxygen, to weaken those immune systems, to get you nice and vulnerable for that second wave coming this fall. get ready for more fake testing, fake numbers in the news, more motorcycle crash covid deaths	0		
these 2 things must not be forgotten reality winner is still in prisonm, the usa has about 25 of the worlds covid cases and deaths despite having less than 5 of the global population, trump locks up heroes and lets his people die 	0		
so much respect to marcus rashford for all the work he has done for charities and children during the coronavirus  pandemic. a brilliant young man	2		
the office of vice president leni robredo releases its full letter addressed to presidential spokesperson harry roque on suggestions for  covid 19 response	1		
marks spencer to cut hundreds of jobs as coronavirus hits sales  	0		
this foreign vaccing shows promising results, offers ray of hope. how is it going to benefit india?	2		
this guy has no sense of empathy or concern for people biden told msnbcs joy reid 	0		
even stephen king couldnt make up a story this horrifying. trump and coronavirus what a scary and deadly combination  	0		
im coronavirus free 14 days since first symptoms	2		
repeat after me i refuse to watch trumps coronavirus task force tv show	0		
at least 45 hospitals in florida had no available beds in intensive care units as of sunday afternoon as the state has emerged as the new epicenter of the us  coronavirus  pandemic  	0		
so is the president going to do anything about coronavirus or is it just too boring for him	0		
encouraging paper in the lancet on the university of oxfords covid vaccines trial. long way to go yet but this is an important development and good result	2		
you thought a mask was inconvenient wait until youre told that you cannot enter a store without proof of the covid 19 vaccine, wait until you cannot go to public events or travel without proof of having received this vaccine	0		
former pandemic officials call trumps covid response a national disaster vanity fair  	0		
13 million public education jobs could be at risk if it doesnt move to prioritize funding for state and local governments in its next coronavirus stimulus package  	0		
because of donald trumps negligence and incompetence more than 140000 people have died. we have over 35 million cases of covid 19, over 20 million americans are out of work, and yet hes patting himself on the back?? unbelievable	0		
ceo of the rwanda development board said the country has a formula for dealing with the coronavirus  including almost 2000 contact tracers and thousands of tests every day. still she said fighting the pandemic is a work in progress  	1		
covid 19 shock as niger assembly discovers food other items meant for palliative stacked in secret warehouses in niger   	1		
its okay if you cant start a personal project while a global pandemic is happening. everyones  experience through this time is their own. stay positive	2		
breaking good news alert new zealand has announced it no longer has any patients in hospital being treated for coronavirus. it comes on the fifth straight day where no new cases have been reported. this is what winning looks like	2		
isnt it time we take big money out of politics please help send me to washington to continue to fight for freedom liberty and the american dream   	1		
dr fauci will throw out the ceremonial first pitch at thursdays  home opener. the team statement calls him a nats superfan and a true champion for our country during the covid 19 pandemic and throughout his distinguished career  	2		
just in a coronavirus vaccine the university of oxford is developing with astrazeneca plc showed promising results in early human testing a sign of progress in the highstakes pursuit of a shot to defeat the pathogen 	2		
20 times trump said the coronavirus would go away   	1		
reported u.s. coronavirus deaths  feb 19 0 deaths mar 19 195 deaths apr 19 40677 deaths may 19 91921 deaths jun 19 119112 deaths jul 19 140500 deaths	1		
since the signing of schengen treaty 35 years ago today, citizens have learned to enjoy the value of freedom of movement in the eu. i am happy that after the restrictions imposed by the coronavirus pandemic, borders are now reopening across the schengen area and the eu	2		
a florida father is hospitalized on a ventilator with covid 19 after his 21 year old son went out with friends and apparently infected the entire family his wife says  	0		
breaking joe biden leads pres trump on trust to handle the coronavirus pandemic by a 20point margin. new poll finds the two had been virtually tied on the issue in late march 	1		
great article in the irish daily mail continuing the fantastic coverage long covid is getting. thanks to everyone who helps raise awareness by being interviewed sharing articles etc it all helps  	2		
the president has not just given up on efforts to combat  coronavirus  hes actively attempting to block efforts to fight it since he likes to call himself a wartime president. hes just surrendered and offered aid and comfort to the enemy treason  	0		
britain has seen so many die during the  covid  pandemic  will have a european deal that will kick a bleeding country when its down because johnson forced competent principled men and women out of the conservative party or left them on the backbenches   	0		
this weekend covid didnt quit but too many nyers did. this is not ny tough and it sure isnt ny smart!! wear a mask, social distance it is not worth the risk  	0		
if masks block covid put masks on prisoners and stop releasing them. maybe we wouldnt have the 300 increase in violent crime	0		
please just wear a mask we can do this 	2		
in nigeria they asked him to come defend some monies spent on covid19 management 	1		
hey guys so i have a bagel business based in east london dagenham if you could like and retweet that would be great! i started in march this year but stopped due to covid and i thank god that the orders have been coming in since opening back up 2 weeks ago. because of your help i can keep my business up and running!!	2		
be gentle with yourself coronavirus and self quarantining effects everyone differently 	1		
60 million infections prevented in the u.s. 285 million in china. 530 million in total across the six countries studied. public health measures have saved millions of lives	2		
bahamas closes borders to us tourists after covid 19 cases spike others still welcomed  	1		
early results from a new study on mental health among journalists covering the pandemic were so worrisome that the reuters institute for the study of journalism decided to publish the preliminary data 	0		
weve seen two live interview polls this week that have biden 15 among registered voters. the other live interview poll had biden 11. the downward trend for trump in these polls can be directly tied to a declining approval of him on coronavirus 	1		
 breaking barbados records additional coronavirus case involves a 76 yo bajan arriving from uk yesterday. has since been isolated.  july 19th barbados covid  by the numbers confirmed cases 105, tests completed 9495, recovered 91, deaths 7  	1		
