text	label
Kansas GOP leadership just successfully blocked Medicaid expansion for another legislative session — in the middle of a pandemic and economic crisis. That’s so deeply irresponsible. #KSSen  #KSLeg  	0
Trump may be done with the  coronavirus  but the  coronavirus  is not done with America by a long shot	0
1/Four out of the five most populous counties in Texas — Dallas, Harris, Bexar and Travis — have hit their highest seven-day average of new cases of #coronavirus  in the last week. Dallas and Harris are currently at their highs.   	0
Florida's Gov. Ron DeSantis shrugs off bad  coronavirus  news as cases rocket 35% in a single day.    	0
A lot of cities are canceling Fourth of July celebrations because of the  coronavirus . You can gather to riot but not celebrate our country?   Liberal hypocrisy at its finest.	0
URGENT ALERT!!!  All MAGA Morons, before you attend your  coronavirus  trump rally, do not forget to sign your waiver saying if you get  coronavirus , it is not trumps fault.  By the way, when you attend, the person standing next to you who coughed probably has  coronavirus .  Enjoy!!!  	0
Dr. Fauci delivered a grim assessment of #coronavirus  calling #COVID19  his “worst nightmare”—highly contagious respiratory infection causing serious illness & death.  “In a period of 4 months, it has devastated the whole world. And it isn’t over yet.”  	0
If we had a president who told people to wear masks, less Americans would end up dying of  coronavirus	0
Trump’s mishandling of #COVID19  and his senseless economic policies led us into a recession and brought an end to the longest economic expansion in American history. This is his legacy.   	0
14 states and Puerto Rico hit highest seven-day average of new  coronavirus  infections    	0
Coronavirus : Beijing shuts food market and goes into in 'wartime emergency mode' after spike in COVID-19 cases   	0
Survey reveals French public has lost confidence in scientists during the  coronavirus  pandemic    	0
Iran is struggling to maintain its influence over Iraqi militias since the killing of a top Iranian general and top militia leader in a U.S. drone strike. Iran's economy is being hammered by the combination of U.S. sanctions and the  coronavirus  pandemic.    	0
By now, we ought to be seeing some evidence of increasing #COVID19  cases from the mass protests. That we are not (and not even an increase in testing demand) raises very serious doubts about the #coronavirus  lockdowns and other NPIs (many of which are still ongoing). (thread  )	0
Once again Trump Admin is not prepared. Why wasn’t this anticipated? Remdesivir, the only drug known to work for Covid-19 treatment will run out at the end of this month. Guess it’s not one of Jared Kushner’s “success stories”  	0
Oh look.  Coronavirus  didn't go anywhere. We're all still dying. Nice of Trump and the gang to just ignore it.  @realDonaldTrump  , #KillingAmerica  , one day at a time! Good times America! Good times!!!    …	0
As the rioters and looters took to the streets for two weeks the media said they were expressing their feelings.  Now that we are talking about Trump rallies all of the sudden the media is talking about the surge of  coronavirus .   Hypocrisy at its finest.	0
As theaters and clubs remain closed, 90% of independent venue owners, promoters and bookers say that they will have to close permanently within the next few months without assistance.   	0
With nearly 1,100 dead and hospitalizations spiking rapidly in Arizona, lawmakers and medical professionals are warning there might not be enough emergency room beds to handle what could be a big influx of new cases.    	0
The  coronavirus  pandemic is ebbing in some of the countries that were hit hard early on. But the number of new cases worldwide is growing, with more than 100,000 reported each day.     	0
80% of US voters believe things are out of control in the country, with majorities concerned about the  coronavirus , the economy and President Trump’s ability to unite the nation, according to latest NBC News/WSJ poll.    	0
Are they literally f****** kidding!?! Shut down Nations, demolish economies, lock people inside their homes, strip their sanity and freedom only now to state ASYMPTOMATIC SPREAD IS 'EXTREMELY RARE'! But don't worry no one will protest over this! #Scamdemic 	0
coronavirus  out of control in AZ and doug ducey is still in charge ...  	0
"Biden says Trump’s handling of the  coronavirus  pandemic was ""almost criminal""    "	0
COVID-19 has taken away everything we had our freedom, our peace of mind and even our lives. Now, the time has come to take revenge on the  coronavirus  by digesting it, literally. #CoronaFreeBharat_withPatanjali  	0
117,000 Americans have now died from the  coronavirus . There is no cure. There is no vaccine. There still aren’t enough tests. Or tracing. Cases are spiking in some states. And the president of the United States has absolutely no plan to do anything about it.	0
We aren’t even out of the first wave of covid. Come on people!! 	0
Wigan has more  Coronavirus  deaths than Australia and New Zealand combined.	0
Texas saw a surge of COVID-19 cases in our private detention centers this week.   Sen. Cornyn is a top recipient of campaign money from the private detention industry. So what is he doing about it? Nothing.  	0
How  corona virus  ruined whole year     …	0
Cuomo threatens to shut down Manhattan, Hamptons again if  coronavirus  social-distancing rules broken//This genius must have been in a coma the past two weeks. Did he miss a million people screaming and spitting two feet from each other for days?! moron  	0
As of this week, more than 30,000 people have died from the  coronavirus  in Brazil, including 1,262 on Tuesday — which was the nation’s highest one-day total.  The country is nearing 800,000 cases, second only to the U.S.     	0
Boris Johnson's 11 fatal errors in handling  coronavirus  crisis which cost lives   	0
Coronavirus  is murdering American citizens  Donald Trump's solution  PLEASE DO NOT SUE ME IF YOU CATCH THE  CORONAVIRUS  AT MY RALLY   ARE YOU FUCKING* KIDDING ME  110 STILL COUNTING DEAD FROM THE  CORONAVIRUS   TRUMP DON'T GIVE A FUK ABOUT NO ONE EXCEPT HIMSELF AND HIS RE-ELECTION  	0
Unreal. As Trump resumes indoor rallies, his campaign has implemented a new policy that attendees CANNOT SUE if they contract  coronavirus  at an event.  Trump supporters, please think about what this means: the man does not care if you live or die.   	0
6 hour lines to vote   Hundreds of polling places closed   States unprepared for mail voting   Huge numbers of ballots rejected   Voter suppression we’re seeing in Georgia today could happen nationwide in Nov if we don’t need fix broken voting system ASAP   	0
# Coronavirus  fatalities in Iran exceeded 50,000 - This catastrophe and such great loss of lives could have been avoided. The death toll in #Iran  and even the official figures could not be compared to the death toll in other countries in the Middle East.   	0
Netanyahu says public carelessness driving  coronavirus  infections up   	0
Why hasn’t @SpeakerPelosi  pushed to freeze rent during the  coronavirus  pandemic?   San Francisco is one of the most expensive zip codes to live in.   Perhaps, she’s got 365,000 reasons not to oppose landlords. #ReplacePelosi 	0
L.A. County  Coronavirus  Update: Highest Single-Day Total of New Cases Since Pandemic Began     	0
"Trump's rally ""meets every criteria for the riskiest type of event""  One expert: ""With a little bad luck, that scenario could end in the seeding of community outbreaks of COVID-19 across the U.S.”  For Trump, it's always politics over the nation's welfare  "	0
So, it begins... again!   Second wave of  coronavirus  is happening, in China. 	0
Deep-rooted inequality and graft have thwarted the steps Peru took to prepare for its response to the  coronavirus  pandemic.     	0
That's just crazy. Bickering between government and opposition meant they can't even agree to debate a bill to help those with disabilities and crack down on  coronavirus  assistance cheats. So debate delayed until next week. Good grief.	0
Texas is in rough shape, man.  	0
With protests are mostly over, the press is desperately trying to return to pushing the lockdown. Too late.  We know they are liars, and that they will break any lockdown rule whenever they want.  	0
People don’t just burn down a Wendy’s like this out of normal anger and frustration. We have reached a boiling point in our country when it comes to racial and economic injustice. The  coronavirus  shutdown and the uncertainty for our future is the perfect formula for a revolution.	0
Andre Guest was a black 16-year-old who was living in strict lockdown.  Coronavirus  killed him in 12 days.  Poor baby. 	0
"Sorry but you can't claim to be the most transparent president in history and then try to keep $511 billion in taxpayer funded loans ""confidential.""   "	0
We just broke the downtrend on #COVID19  in America.  #CoronaVirus  #Protests 	0
It's worth remembering how often @realDonaldTrump  has misled American about #COVID19  .   	0
The  coronavirus  is worse than ever in Alabama. ADPH shows 848 new cases since yesterday, the most in a day since the start of the pandemic. It also pushes the 7-day average of new daily cases to an all-time high of nearly 530 (the first time it's been over 500).  	0
Illegal Immigration is a HUGE problem that no one is talking about because of  CORONA VIRUS .  We need to bring attention back to our borders and back to the crisis of illegal immigration.  Our immigration system is broken and it must be fixed!  #PutSouthAfricansFirstNow	0
“Dr. Anthony S. Fauci, delivered a grim assessment of the devastation wrought around the world by the virus, describing Covid-19 on Tuesday as his ‘worst nightmare’. He said ‘We’re at the beginning of it’.”   	0
Coronavirus  doesn’t give a shit what you’re protesting 	0
I worry that the recognition we gave to passing 100,000 Americans killed by  coronavirus  also marked the end of many people's continuing concern about the pandemic.  13,000+ have died just since that moment.   This isn't done. We can't just stick our heads in the sand.	0
We have just passed another grim milestone: 116,527 Americans have died from the  coronavirus , more than were lost in WW I.  Sadly, we seem to have normalized death. There was much ballyhoo when we passed 9/11, the Korean and then Vietnam War.  We are tragically becoming numb. 	0
This isn't good: COVID19 hospitalizations have been on the rise since Memorial Day in Texas, the Carolinas, Calif., Oregon, Ark., Miss., Utah, and Arizona. Overall, the US continues to have 20,000 known cases per day and testing is down rather than up.  	0
"This should make every person in the world MAD as hell reading this   Esp. those of us who've been locked down in our homes & forced out of businesses for mnths. Or arrested for ""defying CoVid Lockdown orders.""  This letter is the Elite OPENLY MOCKING us.   "	0
The  coronavirus  is still killing thousands of Americans every week, but Trump isn't very interested    	0
The Fed said if economic activity remained weak due to virus-related disruptions more businesses could fail, leading more temporary layoffs to become permanent   	0
Here’s maybe the most revealing fact about how health insurance corporations really see the current climate in America: They’re reaping massive profits this year. In the middle of a pandemic that’s devastating communities of color. (8/9) 	0
When we pass 200,000  coronavirus  deaths, will anyone even notice?	0
"Joe Biden says Trump's handling of the  coronavirus  pandemic was ""almost criminal.""    "	0
George Floyd death: Protests 'undoubtedly risk' increasing  coronavirus  cases, Matt Hancock says   more demos thousands more dead end of racism fucking idiots wake up plebs of  britain	0
UPDATED: Rising COVID-19 hospitalizations in Travis County trigger Stage 4 recommendations   	0
Health experts warn of the potential for COVID-19 spread when President Trump resumes his rallies next weekend in Oklahoma. Trump plans to speak before supporters indoors at a 19,000-seat arena in Tulsa on Saturday.   	0
A housing apocalypse is coming.  A tsunami of renter evictions will happen unless we get seriously organized.  Working people's homeownership was destroyed after Great Recession, especially sharply for black & Latinx. That homeownership never recovered. …	0
the                                      coronavirus                     pandemic                      isn't                                        over              just                                         because    the                           weather    changed.  	0
This is a tragedy we knew was coming. “Nearly 2,000 people in and around Leticia are sick with COVID-19. About 70 have died. That might not sound like a colossal death toll at first. This amounts to the highest per-capita death rate in all of Colombia”  	0
Kudlow to @jaketapper : “Hospitalizations may be going up but that’s because elected procedures are now permitted.”   Texas has reported the number of those hospitalized with  Coronavirus  is at an all-time high. Arizona warned that its ICU’s are filling up with COVID-19 cases.	0
$87 million dollars is a lot of hard-earned tax payer money. And at the moment money is hard to come by for a lot of New Zealanders. One principal says he now has $70,000 of modems stored in a school cupboard. What a terrible waste.  #education  #nzpol  	0
Minuchin and the Trump administration refuse to reveal who got the 500 billion in aid. Why don’t we call this what it is white collar looting but its billions they are stealing #EndTrumpsWarOnAmerica  	0
This is our money. And these kleptocrats refuse to say where the  money went. We are not talking about $5 million. Or even $500 million. We are talking about $511 billion they refuse to say who received it.  	0
Nursing homes have proven to be some of the most vulnerable places for spreading the novel  coronavirus , yet some states across the country are providing perverse incentives for bad nursing homes to take COVID-19 patients.  	0
90% of the UK  coronavirus  cases traced back to holiday hotspots Spain, France, Belgium and Italy. At the height of the pandemic, there were no quarantine rules for arrivals and still no tests. The govt negligence caused thousands of avoidable deaths.  	0
Yesterday, the U.S. surpassed 2 million  coronavirus  cases — and the virus is still killing nearly 1,000 Americans per day. It’s heartbreaking.   This pandemic is not behind us and we need to stay vigilant in making sure our communities are prepared.	0
BREAKING: There are now over 113,000 American deaths from  coronavirus  and over 2 million cases. Trump is the biggest failure and fraud ever. This is on him.	0
Devastating new homelessness numbers in Los Angeles. The homeless population in the county increased 13% to 66,433 — equivalent to a city the size of Redondo Beach. These figures DON'T take into account the effects of the  coronavirus  pandemic  	0
Wisconsin was a wake up call. Georgia was a siren.  If we don’t urgently expand vote by mail AND make it easy to vote safely in person, millions will be disenfranchised in November & legitimacy of 2020 election will be questioned   	0
A second wave of the  coronavirus  is on the way. When it arrives, we will lack the will to deal with it.  Despite all the sacrifices of the past months, the virus is likely to win.  My latest @TheAtlantic .  [Thread.]  	0
OHIO!  Watch this video. The Trump Recession didn’t start because of #coronavirus . It was in full swing in 2019.  Trump promised to bring jobs back to your state. He FAILED. Bigly. #DemCastOH 	0
“I shouldn’t be forced to not take pay or use my vacation, or take the chance of losing my life.”  Workers in our meatpacking plants are essential. And NO ONE should have to choose between losing their job or going to work sick. #IASen  	0
Coronavirus  may not discriminate. But our system does.  	0
Last night at Kid Rock’s Big Honky Tonk and Rock n’ Roll Steakhouse in Nashville, TN. Nashville is in phase 2, allowing restaurants and retail stores to open at 75 percent capacity, while bars remain closed. How is this even legal? #COVID  #coronavirus   	0
Hillary Clinton questions how 'anybody with a beating heart and a working mind' can still support Trump after disastrous  coronavirus  and protest response  	0
There are people who feel that if not controlled, the population of Nigeria may spill over, therefore,  there is a need to keep quiet and watch nigerians die. If HIV did not kill them,  Coronavirus ,  or Terrorist attacks will. @MaziNnamdiKanu  | 10.06.2020	0
""" coronavirus  probably coming back."" The first wave never ended, we acclimated to 1,000 deaths a day and don't talk about it, and the entire social contract has been called off between the government and the governed. Six months left in 2020."	0
In a matter of months, the COVID-19 pandemic has brought the academic job market close to collapse in many parts of the world.   	0
First the wildfire, then WW3 almost started, third the  corona virus . Now this racism and killing with black people. What's next 2020?	0
Nearly 1,000 Americans are still dying every day from  coronavirus . This pandemic is not over. We'll check in w/medical experts tonight during our special @CNNSitRoom  7-10PM ET. Here are the latest numbers of U.S. deaths: June 9 - 983 June 10 – 930 June 11 – 896 June 12 - 851	0
Satellite images of packed Wuhan hospitals suggest  coronavirus  outbreak began earlier than thought  	1
The  coronavirus  death toll has topped 400,000 worldwide, with more than a quarter of those deaths in the U.S. More than 1.9 million people in the U.S. have been infected with COVID-19.  	1
# Eliminate_PTM_BLA  Dawar is seen telling the villagers that  coronavirus  is ‘nothing’ and that it is ‘just a way to make money @TM__Rocks	1
President Trump is set to begin holding large political rallies this month, despite the ongoing pandemic. His campaign did not comment on the specifics of safety protocols.   	1
Dutch protesters demand end to fur farming after  coronavirus  outbreak    	1
So Nigerian alleged billionaire Hushpuppi has been arrested by INTERPOL for scamming and  money laundering of over $100million which was supposed to be given to Native Americans during the  Corona Virus  Pandemic.  	1
1/We tracked a nursing home in Burlington, Vt., which had one of the first outbreaks of the  coronavirus  on the East Coast. 11 people died of Covid; some survived it, even a 90-year-old.   Our story:   	1
So Orange County health director's mandated that everyone wear masks. Then she was forced to resign due to pushback and death threats. Now the new OC health director says face masks aren't mandatory anymore.    …	1
"In Opinion  ""If the United States had the  coronavirus  death rate of the average female-led country, 102,000 American lives would have been saved out of the 114,000 lost,"" @NickKristof  writes   "	1
Hotel operators are installing stickers on floors to promote social distancing. Hand sanitizer dispensers will be placed throughout buildings. At least one hotel moved its lobby to a less crowded location, while others have spaced pool furniture far apart.  	1
Just got my  coronavirus  test results  	1
I need Londoners to be part of shaping our city’s recovery from #COVID19 . What do you want us to change about life here, as part of the recovery? Let us know:	1
What Do Countries With The Best  Coronavirus  Reponses Have In Common? Women Leaders  	1
As at 6th of June, 2020, the @NCDCgov  reported 389 new cases of #COVID19  in Nigeria bringing the total number of reported cases to 12233.  Also, according to @NCDCgov , a total of 3826 recoveries and 342 deaths have been recorded, so far, in Nigeria.  #KnowCovid19  #Coronavirus   	1
Coronavirus  live news: New Zealand 'Covid-19 free' as global cases pass 7 million 	1
This symbol means lunch time in China #coronavirus   	1
In #USA  the view of #China  has also followed a trend among both sides 	1
According to Johns Hopkins University's tally of cases in the United States, there are at least 2,033,003 cases of  coronavirus  in the U.S.; at least 114,126 people have died in the U.S. from  coronavirus .	1
Sources: Expected protocol if an NBA player leaves the Orlando bubble: Quarantined for no less than 10 days and must have two negative  coronavirus  tests.	1
World Health Organisation says transmission of  Coronavirus  by patients who show no symptoms is very rare  	1
# CoronaVirusUpdates  2020-6-9 23:59 UTC Total #COVID19  Deaths Chart (1)  USA: 114.148 (+1.093)  UK: 40.883 (+283)  Brazil: 38.497 (+1.185)  Italy: 34.043 (+79)  France: 29.296 (+87)  Spain: 27.136 (+0)  Mexico: 14.053 (+354) 	1
"This is one recent explanation:  #COVID19  COVID-19 inflames the lining of blood vessels thru the whole body, thus the diverse effects beyond the lungs, it's not ""designed"" but it is systemic:"	1
“We've seen what happens when the roads are quieter – and millions of people have responded by jumping on bikes for the first time in years or, indeed, for the first time ever.”	1
United States   Coronavirus  Cases: 2,159,735 Deaths: 117,830	1
"This dog groomer is working hard to keep New York City dogs clean and healthy by offering free services to ""pet parents"" financially impacted by the  coronavirus  pandemic    "	1
The waiver Trump is requiring attendees of his Oklahoma rally to sign saying they won't hold him responsible, if they contract the #coronavirus .  *That waiver DOES NOT COVER all the people who come in contact with the attendees who signed it, and contract the virus FROM them.	1
UK will not participate in EU’s #coronavirus  fast track vaccine scheme. #torybrexit  #COVID19  catastrophe  	1
The novel  coronavirus  spreads mainly via airborne transmission and wearing a mask is the most effective way to stop person-to-person spread, according to a new study    	1
# PMIKLeadingTheWorld   The scheme Ehsas Emergency Cash Programme is aimed at providing relief to poor people hit by the lockdown, put in place due to  coronavirus .  @lMaha01 	1
REMEMBER: Florida ordered coroners to stop releasing #RepublicansVirus  death data: report   …	1
Seattle #coronavirus  survivor given $1.1 million hospital bill with over 180 pages of charges.  Story:     	1
CHINA: Parts of Beijing locked down due to fresh  coronavirus  cluster.	1
Greece is only allowing countries that have managed the  Coronavirus  well to visit (they have almost no cases).  Albania - yes. The US - not allowed.	1
In Wales, we’re making sure children who receive free school meals will receive this support now and through the summer holidays.   For further information on eligibility and how to apply, please see below    	1
7,998,006 #Coronavirus  cases as of 2020-06-15 03:20:02  	1
UPDATED: The #Prayer  in Light of the #Coronavirus  Pandemic: Wearing Gloves  	1
Near 80% Of People Would Personally Do As Much For Climate As They Have For  Coronavirus . via @forbes 	1
Researchers ask if survivor #plasma  could prevent  coronavirus  @JAMA_current  	1
Coronavirus  patients without symptoms aren’t driving the spread of the virus, the WHO says.    	1
This is important: from tomorrow, it is compulsory to wear face coverings on public transport. If you absolutely must travel, please wear a face covering for the entire journey to help slow the spread of #COVID19 .   Share this with your family and friends to let them know. 	1
SCOOP: Trump to restart rallies within next 2 weeks  A decision that turning point since the  coronavirus  shut down traditional campaigning this spring.  More >>  	1
There’s a new program helping women find work during the  coronavirus  pandemic.@canva ,#coronavirus ,#datacom     	1
Coronavirus  R all you need to know  	1
This is starting to make the rounds. Don’t be fooled. Covid takes 1-2 weeks. The latest spike is from those Memorial Day dopes. Keep fighting! Stay safe & if you’re immuno-compromised or feeling ill STAY HOME! There are lots of ways to show your support!	1
Attendees cannot sue the Trump campaign or the venue if they contract the  coronavirus  at his June 19 rally in Tulsa, Oklahoma    	1
Are you out shopping today?   You should wear a face covering if you can, to protect yourself and those around you from #coronavirus    #StayAlert 	1
Neymar is back in Paris after being nearly three months in Brazil due to the  coronavirus .  	1
The Department of Health in the Western Cape says it is preparing to take  coronavirus  patients to the Cape Town International Convention Centre from tomorrow. The  ICC has been converted into a  hospital for  coronavirus  patients who are not seriously ill. #sabcnews	1
Pakistan recorded 5,834  coronavirus  cases in a single day on June 10.    In March, Italy was recording over 6,000 cases in a day.   	1
Oops, they did it again: The Simpsons might've predicted  coronavirus  & riots in the US, media claims  #simpsonspredictions   	1
Donors tonight at $3-million fundraiser with Pres Trump at his NJ Golf Club underwent  Coronavirus  tests to get in. They had to test negative for COVID-19, fill out a wellness questionnaire and pass a temperature screening. Costs for the tests paid by the Trump Campaign and RNC.	1
Coronavirus  also introduces us to a completely new world of life,  It is better to be safe than sorry..................  	1
Seattle  coronavirus  survivor gets a $1.1 million, 181-page hospital bill   	1
